{
  "schemaVersion": 1,
  "jarFile": "input.jar",
  "classPath": [],
  "javaHome": null,
  "runtimeImage": null,
  "worldModel": "PARTIAL_WORLD",
  "outputDirectory": "out",
  "whiteList": ["example/Adder#add!(II)I"],
  "blackList": [],
  "embeddedLibraryDirectory": "native0",
  "signaturePolicy": "fail",
  "signing": null,
  "intermediates": {
    "enabled": true,
    "includeDebugDumps": false,
    "includePerClassIr": true,
    "includePerClassLlvm": true,
    "includePerClassC": true
  },
  "protection": {
    "enabled": true,
    "seed": null,
    "ir": {
      "enabled": true,
      "controlFlowFlattening": true,
      "fakeBranches": true,
      "basicBlockSplitting": true,
      "constantEncryption": true,
      "stringEncryption": true,
      "methodInlining": true,
      "methodSplitting": true,
      "callIndirection": true,
      "fieldInternalization": false,
      "methodInternalization": false,
      "publicMethodInternalizationAllowList": [],
      "methodTableHiding": true,
      "blockNameObfuscation": true
    },
    "llvm": {
      "enabled": true,
      "nameObfuscation": true,
      "opaquePredicates": true,
      "blockLayoutPerturbation": true,
      "indirectCalls": true,
      "globalLayout": true
    },
    "binary": {
      "enabled": true,
      "hideInternalSymbols": true,
      "strip": true,
      "removePdb": true,
      "symbolAudit": true,
      "retainUnwindInfo": false
    }
  }
}
