{
  "schemaVersion": 1,
  "jarFile": "signed-input.jar",
  "classPath": [],
  "javaHome": null,
  "runtimeImage": null,
  "worldModel": "PARTIAL_WORLD",
  "outputDirectory": "out",
  "whiteList": [],
  "blackList": [],
  "embeddedLibraryDirectory": "native0",
  "signaturePolicy": "resign",
  "signing": {
    "keystorePath": "release-keystore.jks",
    "storePasswordEnv": "J2LL_STORE_PASSWORD",
    "keyAlias": "release",
    "keyPasswordEnv": "J2LL_KEY_PASSWORD",
    "tsaUrl": null
  },
  "intermediates": {
    "enabled": true,
    "includeDebugDumps": false,
    "includePerClassIr": true,
    "includePerClassLlvm": true,
    "includePerClassC": true
  },
  "protection": {
    "enabled": true,
    "seed": null,
    "ir": {
      "enabled": true,
      "controlFlowFlattening": true,
      "fakeBranches": true,
      "basicBlockSplitting": true,
      "constantEncryption": true,
      "stringEncryption": true,
      "methodInlining": true,
      "methodSplitting": true,
      "callIndirection": true,
      "fieldInternalization": false,
      "methodTableHiding": true,
      "blockNameObfuscation": true
    },
    "llvm": {
      "enabled": true,
      "nameObfuscation": true,
      "opaquePredicates": true,
      "blockLayoutPerturbation": true,
      "indirectCalls": true,
      "globalLayout": true
    },
    "binary": {
      "enabled": true,
      "hideInternalSymbols": true,
      "strip": true,
      "removePdb": true,
      "symbolAudit": true
    }
  }
}
