{
  "schemaVersion": 1,
  "jarFile": "input.jar",
  "classPath": [],
  "javaHome": null,
  "runtimeImage": null,
  "worldModel": "CLOSED_WORLD",
  "outputDirectory": "out",
  "whiteList": [],
  "blackList": [],
  "target": {
    "windowsX64": false,
    "windowsArm64": false,
    "linuxX64": false,
    "linuxArm64": false,
    "macosX64": false,
    "macosArm64": true
  },
  "embeddedLibraryDirectory": "native0",
  "signaturePolicy": "strip",
  "signing": null,
  "intermediates": {
    "enabled": true,
    "includeDebugDumps": true,
    "includePerClassIr": true,
    "includePerClassLlvm": true,
    "includePerClassC": true
  },
  "protection": {
    "enabled": true,
    "seed": "replace-with-release-seed",
    "ir": {
      "enabled": true,
      "controlFlowFlattening": true,
      "fakeBranches": true,
      "basicBlockSplitting": true,
      "constantEncryption": true,
      "stringEncryption": true,
      "methodInlining": true,
      "methodSplitting": true,
      "callIndirection": true,
      "fieldInternalization": true,
      "methodInternalization": true,
      "publicMethodInternalizationAllowList": [],
      "methodTableHiding": true,
      "blockNameObfuscation": true
    },
    "llvm": {
      "enabled": true,
      "nameObfuscation": true,
      "opaquePredicates": true,
      "blockLayoutPerturbation": true,
      "indirectCalls": true,
      "globalLayout": true
    },
    "binary": {
      "enabled": true,
      "hideInternalSymbols": true,
      "strip": true,
      "removePdb": true,
      "symbolAudit": true
    }
  }
}
